Disease	Disease_id	Gene	Gene_id	Score_gda	Association_Type	 Type	Original_DB	Sentence	PMID	PMID_Year
Heart failure	C0018801	ADRB2	154	0.3	GeneticVariation		BEFREE	"Numerous studies have demonstrated that beta(1)- and <span class=""gene"" id=""18615004-1-53-80"">beta(2)-adrenergic receptor</span> gene (ADRB1 and <span class=""gene"" id=""18615004-1-97-102"">ADRB2</span>) variants influence cardiovascular risk and beta-blocker responses in hypertension and <span class=""disease"" id=""18615004-1-190-203"">heart failure</span>."	18615004.0	2008.0
Heart failure	C0018801	CALM2	805	0.09	Biomarker		BEFREE	"Defective <span class=""gene"" id=""25036739-2-10-13"">CaM</span>-RyR2 interaction is associated with <span class=""disease"" id=""25036739-2-50-63"">heart failure</span>."	25036739.0	2014.0
Heart failure	C0018801	CD36	948	0.01	Biomarker		BEFREE	"Significant increases in mRNA of genes regulating FA uptake (<span class=""gene"" id=""22701570-3-61-65"">CD36</span>) and intracellular transport (Heart-FA-Binding Protein (HFABP)) were observed in <span class=""disease"" id=""22701570-3-147-149"">HF</span> patients vs CTL."	22701570.0	2012.0
Heart failure	C0018801	SIK3	23387	0.1	GeneticVariation		GWASCAT	Pleiotropic Meta-Analyses of Longitudinal Studies Discover Novel Genetic Variants Associated with Age-Related Diseases.	27790247.0	2016.0
Heart failure	C0018801	VEGFA	7422	0.39	Biomarker		BEFREE	"Several studies of stem cell-based gene therapy have indicated that long-lasting regeneration following vessel ischemia may be stimulated through <span class=""gene"" id=""25860916-1-146-151"">VEGFA</span> gene therapy and/or MSC transplantation for reduction of ischemic injury in limb ischemia and <span class=""disease"" id=""25860916-1-246-259"">heart failure</span>."	25860916.0	2016.0
Heart failure	C0018801	DMD	1756	0.2	Biomarker		BEFREE	"We investigated the integrity of <span class=""gene"" id=""14998622-1-33-43"">dystrophin</span> in left ventricle (LV) and right ventricle (RV) of patients with end-stage <span class=""disease"" id=""14998622-1-119-132"">heart failure</span> due to ischemic cardiomyopathy (IHD) or dilated cardiomyopathy (DCM), and compared the efficacy of pulsatile or continuous flow assist devices on <span class=""gene"" id=""14998622-1-279-289"">dystrophin</span> reverse remodeling."	14998622.0	2004.0
Heart failure	C0018801	ADRB1	153	0.6	AlteredExpression		BEFREE	"Analysis of beta-adrenergic receptor mRNA levels in human ventricular biopsy specimens by quantitative polymerase chain reactions: progressive reduction of <span class=""gene"" id=""8522688-0-156-182"">beta 1-adrenergic receptor</span> mRNA in <span class=""disease"" id=""8522688-0-191-204"">heart failure</span>."	8522688.0	1996.0
Heart failure	C0018801	EIF3K	27335	0.01	Biomarker		BEFREE	"We have previously shown that genetic ablation of melusin, a <span class=""gene"" id=""15860758-1-61-76"">muscle specific</span> beta 1 integrin interacting protein, accelerates left ventricle (LV) dilation and <span class=""disease"" id=""15860758-1-159-172"">heart failure</span> in response to pressure overload."	15860758.0	2005.0
Heart failure	C0018801	GRK2	156	0.6	AlteredExpression		BEFREE	"Alternation of <span class=""gene"" id=""23460259-2-15-19"">GRK2</span> protein level and activity casts profound effects on cell physiological functions and causes diseases such as <span class=""disease"" id=""23460259-2-130-143"">heart failure</span>, rheumatoid arthritis, and obesity."	23460259.0	2013.0
Heart failure	C0018801	PIM1	5292	0.01	AlteredExpression		BEFREE	"hCPCs isolated from the myocardium of <span class=""disease"" id=""22841153-4-38-51"">heart failure</span> patients undergoing left ventricular assist device implantation were engineered to express green fluorescent protein (hCPCe) or <span class=""gene"" id=""22841153-4-180-185"">Pim-1</span>-GFP (hCPCeP)."	22841153.0	2012.0
Heart failure	C0018801	PRKACG	5568	0.01	Biomarker		BEFREE	"Protein kinase C (PKC) isozymes, a family of <span class=""gene"" id=""19168855-6-45-76"">serine-threonine protein kinase</span> enzymes, were found to regulate a number of cardiac responses, including those associated with <span class=""disease"" id=""19168855-6-172-174"">HF</span>."	19168855.0	2009.0
Heart failure	C0018801	TFAM	7019	0.03	AlteredExpression		BEFREE	"Overexpression of <span class=""gene"" id=""16043643-0-18-54"">mitochondrial transcription factor a</span> ameliorates mitochondrial deficiencies and <span class=""disease"" id=""16043643-0-98-113"">cardiac failure</span> after myocardial infarction."	16043643.0	2006.0
Heart failure	C0018801	PRRT2	112476	0.02	AlteredExpression		BEFREE	"Proline-rich tyrosine kinase 2 (Pyk2) is a nonreceptor protein kinase regulated by intracellular Ca(2+), CaMK, and <span class=""gene"" id=""21666110-1-115-118"">PKC</span> and can be activated by different stress signals involved in <span class=""disease"" id=""21666110-1-180-193"">heart failure</span>."	21666110.0	2011.0
Heart failure	C0018801	ACE	1636	0.6	GeneticVariation		BEFREE	"The male sibling developed <span class=""disease"" id=""15940697-4-27-40"">heart failure</span> and severe hypertension, and died at the age of 6 weeks despite of treatment with bisphosphonates, <span class=""gene"" id=""15940697-4-140-143"">ACE</span> inhibitors, and hydralazine."	15940697.0	2005.0
Heart failure	C0018801	ADRB1	153	0.6	GeneticVariation		BEFREE	"Such treatment has the potential to enable pharmacogenetics, such as the prevention of 100,000 deaths per year in the USA because of adverse drug reactions or specify treatment in <span class=""disease"" id=""20559952-2-180-193"">heart failure</span> such at the <span class=""gene"" id=""20559952-2-206-232"">beta 1 adrenergic receptor</span> polymorphisms."	20559952.0	2010.0
Heart failure	C0018801	PLN	5350	0.3	AlteredExpression		BEFREE	"<span class=""gene"" id=""10468529-2-0-13"">Phospholamban</span> (<span class=""gene"" id=""10468529-2-15-18"">PLB</span>) inhibits SERCA2 activity and is therefore a potential target to improve the cardiac performance in <span class=""disease"" id=""10468529-2-119-132"">heart failure</span>."	10468529.0	1999.0
Heart failure	C0018801	SLC8A1	6546	0.25	AlteredExpression		BEFREE	"Is myocardial <span class=""gene"" id=""10898440-0-14-32"">Na+/Ca2+ exchanger</span> transcription a marker for different stages of myocardial dysfunction? Quantitative polymerase chain reaction of the messenger RNA in endomyocardial biopsies of patients with <span class=""disease"" id=""10898440-0-208-221"">heart failure</span>."	10898440.0	2000.0
Heart failure	C0018801	TLR4	7099	0.02	AlteredExpression		LHGDN	Elevated circulating levels of HSP70 may be involved in <span class=gene id=16714144>TLR4</span> signal-mediated immune response and the progression of <span class=disease id=16714144>heart failure</span> after acute myocardial infarction	16714144.0	2007.0
Heart failure	C0018801	PIK3CD	5293	0.03	GeneticVariation		BEFREE	"Mice deficient in <span class=""gene"" id=""17404510-4-18-22"">PI3K</span>(p110alpha) displayed accelerated <span class=""disease"" id=""17404510-4-56-69"">heart failure</span> in response to dilated or hypertrophic cardiomyopathy."	17404510.0	2007.0
Heart failure	C0018801	TNF	7124	0.6	Biomarker		BEFREE	"<span class=""gene"" id=""11796554-1-0-28"">Tumour necrosis factor alpha</span> (TNF alpha) is implicated in the pathophysiology of <span class=""disease"" id=""11796554-1-81-94"">heart failure</span>."	11796554.0	2002.0
Heart failure	C0018801	NPPB	4879	0.6	AlteredExpression		BEFREE	"In BIO14.6 and BIO53.58 strains at this age, ventricular <span class=""gene"" id=""8083346-10-57-60"">BNP</span> and ANP gene expressions are augmented, and the plasma <span class=""gene"" id=""8083346-10-116-119"">BNP</span> concentration is elevated to 136 and 108 fmol/ml, respectively, three times greater than the elevated plasma ANP concentration, which well mimics changes of the plasma <span class=""gene"" id=""8083346-10-288-291"">BNP</span> and ANP concentrations in human <span class=""disease"" id=""8083346-10-324-337"">heart failure</span>."	8083346.0	1994.0
Heart failure	C0018801	EDN1	1906	0.6	Biomarker		BEFREE	"Elevation of ventricular filling pressure up-regulates RLX expression and the hormone acts as a potent inhibitor of <span class=""gene"" id=""11641245-4-116-128"">endothelin 1</span>, the most powerful vasoconstrictor in <span class=""disease"" id=""11641245-4-167-180"">heart failure</span>."	11641245.0	2001.0
Heart failure	C0018801	NFE2L2	4780	0.31	Biomarker		BEFREE	"The role of <span class=""gene"" id=""25101151-0-12-16"">Nrf2</span>-mediated pathway in cardiac remodeling and <span class=""disease"" id=""25101151-0-60-73"">heart failure</span>."	25101151.0	2015.0
Heart failure	C0018801	HMGB1	3146	0.21	Therapeutic		RGD	"Extracellular <span class=""gene"" id=""24204700-0-14-39"">high mobility group box 1</span> plays a role in the effect of bone marrow mononuclear cell transplantation for <span class=""disease"" id=""24204700-0-119-132"">heart failure</span>."	24204700.0	2013.0
Heart failure	C0018801	LOX	4015	0.04	Biomarker		BEFREE	"<span class=""gene"" id=""28522596-1-0-13"">Lysyl oxidase</span> (<span class=""gene"" id=""28522596-1-15-18"">LOX</span>) controls matrix remodeling, a key process that underlies cardiovascular diseases and <span class=""disease"" id=""28522596-1-105-118"">heart failure</span>; however, a lack of suitable animal models has limited our knowledge with regard to the contribution of <span class=""gene"" id=""28522596-1-223-226"">LOX</span> to cardiac dysfunction."	28522596.0	2017.0
Heart failure	C0018801	ADRB1	153	0.6	AlteredExpression		BEFREE	"The stronger regulation of the <span class=""gene"" id=""12034720-10-31-47"">Gly-49-beta(1)AR</span> could explain the beneficial effect of the Gly-49 genotypes on survival, further supporting the concept that <span class=""gene"" id=""12034720-10-157-166"">beta(1)AR</span> desensitization is protective in <span class=""disease"" id=""12034720-10-200-213"">heart failure</span>."	12034720.0	2002.0
Heart failure	C0018801	ACE	1636	0.6	Biomarker		BEFREE	"ACE2, the first known human homologue of <span class=""gene"" id=""10969042-1-41-70"">angiotensin-converting enzyme</span> (<span class=""gene"" id=""10969042-1-72-75"">ACE</span>), was identified from 5' sequencing of a human <span class=""disease"" id=""10969042-1-123-136"">heart failure</span> ventricle cDNA library."	10969042.0	2000.0
Heart failure	C0018801	ACE	1636	0.6	GeneticVariation		BEFREE	"Preliminary studies suggest that the I/D polymorphism of the <span class=""gene"" id=""10937920-3-61-90"">Angiotensin Converting Enzyme</span> gene influence the development of left ventricular hypertrophy, a major determinant of <span class=""disease"" id=""10937920-3-178-191"">heart failure</span>."	10937920.0	2000.0
Heart failure	C0018801	DUOX2	50506	0.02	AlteredExpression		BEFREE	"We showed a novel role of p47(phox) subunit beyond and independent of <span class=""gene"" id=""23553616-10-70-121"">nicotinamide adenine dinucleotide phosphate oxidase</span> activity as a regulator of cortactin and adaptive cytoskeletal remodeling, leading to a paradoxically enhanced susceptibility to biomechanical stress and <span class=""disease"" id=""23553616-10-276-289"">heart failure</span>."	23553616.0	2013.0
Heart failure	C0018801	ATP2A2	488	0.6	AlteredExpression		BEFREE	"Phospholamban (PLB) inhibits <span class=""gene"" id=""10468529-2-29-35"">SERCA2</span> activity and is therefore a potential target to improve the cardiac performance in <span class=""disease"" id=""10468529-2-119-132"">heart failure</span>."	10468529.0	1999.0
Heart failure	C0018801	CASQ2	845	0.25	GeneticVariation		BEFREE	"Studies on the consequences of RyR2 and <span class=""gene"" id=""19879546-2-40-45"">CASQ2</span> mutations in cellular systems and mouse models have shed new light on pathways that are also implicated in arrhythmias occurring in highly prevalent diseases, such as <span class=""disease"" id=""19879546-2-213-226"">heart failure</span>."	19879546.0	2010.0
Heart failure	C0018801	HIF1A	3091	0.57	Biomarker		BEFREE	"Analysis of animal models suggests that by activation of these homeostatic mechanisms, <span class=""gene"" id=""23988176-5-87-92"">HIF-1</span> plays a critical protective role in the pathophysiology of ischemic heart disease and pressure-overload <span class=""disease"" id=""23988176-5-197-210"">heart failure</span>."	23988176.0	2014.0
Heart failure	C0018801	ADRB3	155	0.51	Biomarker		CTD_human	"If the levels of <span class=""gene"" id=""15009959-15-17-27"">beta(3)-AR</span> were too high, they might contribute to the loss of cardiac function and be the foundation of the functional degradation of <span class=""disease"" id=""15009959-15-152-154"">HF</span>."	15009959.0	2004.0
Heart failure	C0018801	RYR2	6262	0.3	Biomarker		BEFREE	"<span class=""disease"" id=""19300450-8-0-13"">Heart failure</span>-related genes, such as brain natriuretic peptide, connective tissue growth factor and osteopontin; calcium signaling-related genes, such as <span class=""gene"" id=""19300450-8-154-174"">ryanodine receptor 2</span>, sarcoendoplasmic reticulum Ca(2+)-ATPase 2A2 and adenylate cyclase 7; renin-angiotensin system-related genes, such as angiotensinogen, angiotensin II receptor, type 1 and type 2; and mitochondria-related genes, such as peroxisome proliferator-activated receptor-gamma co-activator-1alpha, cytochrome c and transcription factor A mitochondrial, were significantly changed at the apical ventricle rather than at the basal ventricle."	19300450.0	2009.0
Heart failure	C0018801	GRHL1	29841	0.1	GeneticVariation		GWASCAT	Pleiotropic Meta-Analyses of Longitudinal Studies Discover Novel Genetic Variants Associated with Age-Related Diseases.	27790247.0	2016.0
Heart failure	C0018801	ECE1	1889	0.22	Biomarker		BEFREE	"Deloading of the left ventricle by ventricular assist device normalizes increased expression of endothelin ET(A) receptors but <span class=""negexp"">not</span> <span class=""gene"" id=""11082385-0-131-161"">endothelin-converting enzyme-1</span> in patients with end-stage <span class=""disease"" id=""11082385-0-189-202"">heart failure</span>."	11082385.0	2000.0
Heart failure	C0018801	HJV	148738	0.1	Biomarker		HPO			
Heart failure	C0018801	SLC6A2	6530	0.02	Biomarker		BEFREE	"Activity of the uptake-1 <span class=""gene"" id=""14668769-0-25-51"">norepinephrine transporter</span> as measured by I-123 MIBG in <span class=""disease"" id=""14668769-0-81-94"">heart failure</span> patients with a loss-of-function polymorphism of the presynaptic alpha2C-adrenergic receptor."	14668769.0	2004.0
Heart failure	C0018801	POSTN	10631	0.22	GeneticVariation		BEFREE	"Associations among <span class=""gene"" id=""21558869-0-19-28"">periostin</span> gene polymorphisms, clinical parameters and <span class=""disease"" id=""21558869-0-73-86"">heart failure</span>: a case-control study in 1104 Chinese individuals."	21558869.0	2011.0
Heart failure	C0018801	UCP2	7351	0.2	Biomarker		RGD	"[The relationship between <span class=""gene"" id=""20193183-0-26-46"">uncoupling protein 2</span> expression and myocardial high energy phosphates content in abdominal aorta constriction induced <span class=""disease"" id=""20193183-0-144-157"">heart failure</span> rats]."	20193183.0	2010.0
Heart failure	C0018801	FASN	2194	0.3	Biomarker		CTD_human	"Similarly, adult <span class=""gene"" id=""26670611-5-17-21"">FASN</span> transgenic mice developed signs of <span class=""disease"" id=""26670611-5-57-70"">heart failure</span>."	26670611.0	2016.0
Heart failure	C0018801	TRPC6	7225	0.02	GeneticVariation		BEFREE	"TRPs are implicated in the development of cardiac hypertrophy (TRPC1, TRPC3, <span class=""gene"" id=""17382525-6-77-82"">TRPC6</span>), the electrophysiological perturbations associated with hypertrophy (TRPM4) and the progression to <span class=""disease"" id=""17382525-6-183-196"">heart failure</span> (<span class=""disease"" id=""17382525-6-198-203"">TRPC7</span>)."	17382525.0	2007.0
Heart failure	C0018801	TP53	7157	0.28	Biomarker		BEFREE	"Tumor suppressor protein <span class=""gene"" id=""20413784-2-25-28"">p53</span> accumulates in the myocardium after myocardial infarction, causes apoptosis of cardiomyocytes, and plays an important role in the progression into <span class=""disease"" id=""20413784-2-176-189"">heart failure</span>."	20413784.0	2010.0
Heart failure	C0018801	TGFB1	7040	0.02	Biomarker		BEFREE	"Up-regulation was evident for muscle LIM protein (Mlp), desmin, and <span class=""disease"" id=""25541130-11-68-81"">heart failure</span> (natriuretic peptide A [Nppa], Nppb, and myosin heavy chain 6) and fibrosis (<span class=""gene"" id=""25541130-11-159-192"">transforming growth factor beta 1</span>, alpha-smooth muscle actin, osteopontin, and periostin) markers."	25541130.0	2015.0
Heart failure	C0018801	AHSA1	10598	0.02	Biomarker		BEFREE	"β₂-Adrenoceptors, NADPH oxidase, ROS and <span class=""gene"" id=""21271996-0-41-44"">p38</span> MAPK: another 'radical' road to <span class=""disease"" id=""21271996-0-77-90"">heart failure</span>?"	21271996.0	2011.0
Heart failure	C0018801	MMP2	4313	0.2	Biomarker		RGD	MMP/TIMP expression in spontaneously hypertensive heart failure rats: the effect of ACE- and MMP-inhibition.	10773234.0	2000.0
Heart failure	C0018801	PDE3A	5139	0.01	AlteredExpression		BEFREE	"These data suggest that the downregulation of <span class=""gene"" id=""17332439-8-46-51"">PDE3A</span> observed in failing hearts may play a causative role in the progression of <span class=""disease"" id=""17332439-8-127-140"">heart failure</span>, in part, by inducing ICER and promoting cardiac myocyte dysfunction."	17332439.0	2007.0
Heart failure	C0018801	RYR2	6262	0.3	GeneticVariation		BEFREE	"In conclusion, <span class=""disease"" id=""15201156-9-15-28"">heart failure</span> and exercise-induced sudden cardiac death have been linked to defects in <span class=""gene"" id=""15201156-9-102-106"">RyR2</span>-calstabin2 regulation, and this may represent a novel target for the prevention and treatment of these forms of heart disease."	15201156.0	2004.0
Heart failure	C0018801	ADRB1	153	0.6	Biomarker		BEFREE	"Detection of anti-<span class=""gene"" id=""22811559-0-18-23"">β1-AR</span> autoantibodies in <span class=""disease"" id=""22811559-0-42-55"">heart failure</span> by a cell-based competition ELISA."	22811559.0	2012.0
Heart failure	C0018801	EDN1	1906	0.6	Biomarker		CTD_human	"The combination of ACE inhibitor and ARB, independently of the hypotensive effect, improved LV phenotypic change and increased LV <span class=""gene"" id=""11136700-7-130-142"">endothelin-1</span> production and collagen accumulation, diastolic dysfunction, and survival in a rat <span class=""disease"" id=""11136700-7-226-239"">heart failure</span> model more effectively than either agent alone, thereby providing solid experimental evidence that the combination of these 2 agents is more beneficial than monotherapy for treatment of <span class=""disease"" id=""11136700-7-426-439"">heart failure</span>."	11136700.0	2001.0
Heart failure	C0018801	TPCN2	219931	0.01	AlteredExpression		BEFREE	"Ca(2+)-handling genes TPCN1 and <span class=""gene"" id=""22701570-11-32-37"">TPCN2</span> also showed increased expression in <span class=""disease"" id=""22701570-11-74-76"">HF</span>, while <span class=""disease"" id=""22701570-11-84-86"">HF</span>- and CM-specific positive correlations were found among several FA and Ca(2+)-handling genes."	22701570.0	2012.0
Heart failure	C0018801	MMP12	4321	0.01	GeneticVariation		BEFREE	"For <span class=""gene"" id=""21887284-12-4-9"">MMP12</span> -82A&gt;G (<span class=""variant"" dbSNP=""rs2276109"" genes_norm=""4318;4321"">rs2276109</span>), <span class=""negexp"">no pharmacogenetic effect</span> was found for the primary outcome, although lower HRs were observed for AA homozygotes in the chlorthalidone-amlodipine comparison for <span class=""disease"" id=""21887284-12-191-193"">HF</span> (P = 0.015)."	21887284.0	2012.0
Heart failure	C0018801	SCN5A	6331	0.3	Biomarker		RGD	"Correspondingly, the relative mRNA levels of the neuronal isoforms SCN1a and SCN8a increased 2.5- and 2.7-fold, respectively; SCN3a did not change, whereas <span class=""gene"" id=""19584134-11-156-161"">SCN5a</span> decreased by approximately 60% in <span class=""disease"" id=""19584134-11-196-198"">HF</span>."	19584134.0	2010.0
Heart failure	C0018801	IGF1	3479	0.28	Biomarker		BEFREE	"<span class=""gene"" id=""19332270-1-0-28"">Insulin-like growth factor-1</span> (<span class=""gene"" id=""19332270-1-30-35"">IGF-1</span>) and insulin-like growth factor binding proteins (IGFBPs) might play a pathogenic role in <span class=""disease"" id=""19332270-1-126-139"">heart failure</span>."	19332270.0	2009.0
Heart failure	C0018801	IL10	3586	0.23	ModifyingMutation		RGD	"Significance of changes in TNF-alpha and <span class=""gene"" id=""16461369-0-41-46"">IL-10</span> levels in the progression of <span class=""disease"" id=""16461369-0-76-89"">heart failure</span> subsequent to myocardial infarction."	16461369.0	2006.0
Heart failure	C0018801	ADRB1	153	0.6	Biomarker		BEFREE	"A novel polymorphism in the gene coding for the <span class=""gene"" id=""11052857-0-48-75"">beta(1)-adrenergic receptor</span> associated with survival in patients with <span class=""disease"" id=""11052857-0-118-131"">heart failure</span>."	11052857.0	2001.0
Heart failure	C0018801	ADRB1	153	0.6	GeneticVariation		BEFREE	"<span class=""gene"" id=""22815685-0-0-22"">β1 adrenergic receptor</span> polymorphisms and <span class=""disease"" id=""22815685-0-41-54"">heart failure</span>: a meta-analysis on susceptibility, response to β-blocker therapy and prognosis."	22815685.0	2013.0
Heart failure	C0018801	PEBP1	5037	0.31	Biomarker		BEFREE	"<span class=""gene"" id=""26479924-7-0-5"">Pebp1</span> gene transfer in a mouse model of <span class=""disease"" id=""26479924-7-40-53"">heart failure</span> has beneficial effects, suggesting a new therapeutic strategy for <span class=""disease"" id=""26479924-7-120-133"">heart failure</span> therapy."	26479924.0	2016.0
Heart failure	C0018801	ADRB1	153	0.6	AlteredExpression		BEFREE	"A decrease in the density of the <span class=""gene"" id=""1811054-1-33-59"">beta 1-adrenergic receptor</span> and an increase in the functional activity of the G inhibitory protein Gi accompany human <span class=""disease"" id=""1811054-1-150-163"">heart failure</span>; however, the molecular and biochemical mechanisms responsible for these changes are unclear."	1811054.0	1992.0
Heart failure	C0018801	PIK3CG	5294	0.33	Biomarker		CTD_human	"Signaling via the G-protein-coupled beta-adrenergic receptors has been implicated in cardiac hypertrophy and <span class=""disease"" id=""12963636-2-109-122"">heart failure</span>, suggesting that <span class=""gene"" id=""12963636-2-140-149"">PI3Kgamma</span> might play a role in the pathogenesis of heart disease."	12963636.0	2003.0
Heart failure	C0018801	TNF	7124	0.6	GeneticVariation		BEFREE	"<span class=""gene"" id=""18450464-0-0-9"">TNF-alpha</span> gene promoter polymorphism at nucleotide -308 and the inflammatory response and oxidative stress induced by cardiac surgery: role of <span class=""disease"" id=""18450464-0-143-156"">heart failure</span> and medical treatment."	18450464.0	2009.0
Heart failure	C0018801	MIR25	407014	0.03	AlteredExpression		BEFREE	"(2014) show that upregulation of <span class=""gene"" id=""24896535-2-33-44"">microRNA-25</span> impairs calcium handling leading to pump dysfunction and that targeting <span class=""gene"" id=""24896535-2-117-128"">microRNA-25</span> using antisense oligonucleotides reverses pump dysfunction and improves survival in mice with <span class=""disease"" id=""24896535-2-223-236"">heart failure</span>."	24896535.0	2015.0
Heart failure	C0018801	LEP	3952	0.01	Biomarker		BEFREE	"Increased circulating <span class=""gene"" id=""19919993-1-22-28"">leptin</span> is present in human <span class=""disease"" id=""19919993-1-49-62"">heart failure</span>, and leptin deficiency is linked to worse outcomes in chronic ischemic injury."	19919993.0	2009.0
Heart failure	C0018801	REN	5972	0.4	Biomarker		BEFREE	"Thus, the expression of the cardiac ACE but <span class=""negexp"">not of human heart chymase is upregulated in failing human heart indicating an activation of the cardiac</span> <span class=""gene"" id=""8040271-9-149-154"">renin</span>-angiotensin system in patients with advanced <span class=""disease"" id=""8040271-9-200-213"">heart failure</span>."	8040271.0	1994.0
Heart failure	C0018801	HP	3240	0.22	GeneticVariation		BEFREE	"A plasma level of <span class=""gene"" id=""21767674-9-18-20"">Hp</span> below 1.4g/L predicted the occurrence of <span class=""disease"" id=""21767674-9-62-75"">heart failure</span> (NYHA 2, 3, 4) at 1-year with 100% sensitivity."	21767674.0	2012.0
Heart failure	C0018801	TP53	7157	0.28	Biomarker		CTD_mouse	Deprivation of MKK7 in cardiomyocytes provokes heart failure in mice when exposed to pressure overload.	21284947.0	2011.0
Heart failure	C0018801	LGALS16	148003	0.02	Biomarker		BEFREE	"Galectin-3 (Gal-3), a <span class=""gene"" id=""23117656-2-22-50"">β-galactoside-binding lectin</span>, plays an important role in inflammation, fibrosis, and <span class=""disease"" id=""23117656-2-107-120"">heart failure</span>."	23117656.0	2013.0
Heart failure	C0018801	ARRB1	408	0.21	AlteredExpression		BEFREE	"Quantitation by reverse-transcription polymerase chain reactions showed that in <span class=""disease"" id=""8293560-5-80-93"">heart failure</span> there were no changes of the mRNA levels for <span class=""gene"" id=""8293560-5-139-154"">beta-arrestin-1</span> and beta-arrestin-2, a slight (&lt; 50%) increase of the mRNA for beta ARK-2, and a threefold increase for beta ARK-1 mRNA."	8293560.0	1994.0
