Disease	Disease_id	Gene	Gene_id	Score_gda	Association_Type	 Type	Original_DB	Sentence	PMID	PMID_Year
Heart failure	C0018801	CSF2	1437	0.3	Biomarker		CTD_human	Full-dose CHOP chemotherapy combined with granulocyte colony-stimulating factor for aggressive non-Hodgkin's lymphoma in elderly patients: a prospective study.	11732872.0	2001.0
Heart failure	C0018801	GRK5	2869	0.04	GeneticVariation		BEFREE	"A <span class=""gene"" id=""18425130-0-2-6"">GRK5</span> polymorphism that inhibits beta-adrenergic receptor signaling is protective in <span class=""disease"" id=""18425130-0-86-99"">heart failure</span>."	18425130.0	2008.0
Heart failure	C0018801	ACE	1636	0.6	GeneticVariation		BEFREE	"<span class=""gene"" id=""15721506-0-0-29"">Angiotensin-converting enzyme</span> gene deletion polymorphism modulation of onset of symptoms and survival rate of patients with <span class=""disease"" id=""15721506-0-124-137"">heart failure</span>."	15721506.0	2005.0
Heart failure	C0018801	XDH	7498	0.32	Biomarker		CTD_human	Uric acid-lowering treatment with benzbromarone in patients with heart failure: a double-blind placebo-controlled crossover preliminary study.	19933411.0	2010.0
Heart failure	C0018801	GRK2	156	0.6	Biomarker		BEFREE	"Recent advances in transgenic and gene therapy techniques have presented novel therapeutic strategies for management of <span class=""disease"" id=""15524162-6-120-133"">heart failure</span> via genetic manipulation of beta-AR signaling including the targeted inhibition of the beta-AR kinase (betaARK1 or <span class=""gene"" id=""15524162-6-249-253"">GRK2</span>)."	15524162.0	2005.0
Heart failure	C0018801	ATP2A2	488	0.6	Biomarker		CTD_human	Differential contractile impairment of fast- and slow-twitch skeletal muscles in a rat model of doxorubicin-induced congestive heart failure.	19776660.0	2010.0
Heart failure	C0018801	ADIPOQ	9370	0.3	Biomarker		CTD_human	Inhibition of G-protein-coupled Receptor Kinase 2 Prevents the Dysfunctional Cardiac Substrate Metabolism in Fatty Acid Synthase Transgenic Mice.	26670611.0	2016.0
Heart failure	C0018801	HIF1A	3091	0.57	Biomarker		CTD_human	"<span class=""gene"" id=""15732037-13-0-10"">HIF-1alpha</span> and VEGF mRNA and protein expression were upregulated in the rat model of volume-overload <span class=""disease"" id=""15732037-13-101-114"">heart failure</span>."	15732037.0	2005.0
Heart failure	C0018801	ACE	1636	0.6	GeneticVariation		BEFREE	"<span class=""gene"" id=""14602526-0-0-29"">Angiotensin-converting-enzyme</span> gene polymorphism and <span class=""disease"" id=""14602526-0-52-65"">heart failure</span>: a case-control study."	14602526.0	2004.0
Heart failure	C0018801	RBM20	282996	0.11	GeneticVariation		BEFREE	"<span class=""gene"" id=""19712804-14-0-5"">RBM20</span> mutations are associated with young age at diagnosis, end-stage <span class=""disease"" id=""19712804-14-70-83"">heart failure</span>, and high mortality."	19712804.0	2009.0
Heart failure	C0018801	TNF	7124	0.6	Biomarker		CTD_human	Transforming growth factor-beta receptor antagonism attenuates myocardial fibrosis in mice with cardiac-restricted overexpression of tumor necrosis factor.	18034274.0	2008.0
Heart failure	C0018801	LOC107984055	107984055	0.01	Biomarker		BEFREE	"Uptake-1 overexpression significantly improved left ventricular (LV) diameters (LV end-diastolic diameter: in <span class=""gene"" id=""16166553-10-110-113"">GCP</span>-overexpressing failing rabbits (GFP-CHF), 17.4+/-0.4 mm; in uptake-1-CHF rabbits, 15.6+/-0.6 mm) and systolic contractility (fractional shortening: GFP-CHF, 20.7+/-0.6%; uptake-1-CHF, 27.3+/-0.7%), as assessed by echocardiography at the end of the <span class=""disease"" id=""16166553-10-362-375"">heart failure</span> protocol."	16166553.0	2005.0
Heart failure	C0018801	ACE	1636	0.6	Therapeutic		RGD	"Effects of spironolactone and eprosartan on cardiac remodeling and <span class=""gene"" id=""15894569-0-67-96"">angiotensin-converting enzyme</span> isoforms in rats with experimental <span class=""disease"" id=""15894569-0-132-145"">heart failure</span>."	15894569.0	2005.0
Heart failure	C0018801	AGTR1	185	0.6	AlteredExpression		LHGDN	patients with hypertension and congestive <span class=disease id=18767410>heart failure</span> demonstrated the DD angiotensin-converting enzyme genotype and the CC <span class=gene id=18767410>angiotensin II type 1 receptor</span> genotype	18767410.0	2008.0
Heart failure	C0018801	GHSR	2693	0.01	Biomarker		BEFREE	"Altered myocardial expression of ghrelin and its receptor (<span class=""gene"" id=""20804798-0-59-63"">GHSR</span>-1a) in patients with severe <span class=""disease"" id=""20804798-0-92-105"">heart failure</span>."	20804798.0	2011.0
Heart failure	C0018801	FABP4	2167	0.01	Biomarker		BEFREE	"Role of the <span class=""gene"" id=""28420707-0-12-40"">fatty acid-binding protein 4</span> in <span class=""disease"" id=""28420707-0-44-57"">heart failure</span> and cardiovascular disease."	28420707.0	2017.0
Heart failure	C0018801	PLD2	5338	0.2	Biomarker		RGD	Expression of phospholipase D isozymes in scar and viable tissue in congestive heart failure due to myocardial infarction.	15601581.0	2004.0
Heart failure	C0018801	SDS	10993	0.01	AlteredExpression		BEFREE	"<span class=""gene"" id=""15238456-3-0-3"">SDS</span>-agarose gels revealed small N2B (stiff) and large N2BA (compliant) cardiac titin isoforms with a mean N2BA:N2B expression ratio that was significantly (P&lt;0.003) increased in 20 <span class=""disease"" id=""15238456-3-181-194"">heart failure</span> patients versus 6 controls.However, total titin was unchanged."	15238456.0	2005.0
Heart failure	C0018801	CAD	790	0.03	Biomarker		BEFREE	"Leucocyte telomere length is considered a marker of biological ageing and has been suggested to be shorter in patients with <span class=""gene"" id=""25639660-1-124-127"">CAD</span> and <span class=""disease"" id=""25639660-1-132-145"">heart failure</span> compared with healthy controls."	25639660.0	2016.0
Heart failure	C0018801	CDK9	1025	0.02	Biomarker		BEFREE	"Given the dual transcriptional roles of <span class=""gene"" id=""15514168-8-40-44"">Cdk9</span> in hypertrophic growth and mitochondrial dysfunction, we suggest the potential usefulness of <span class=""gene"" id=""15514168-8-138-142"">Cdk9</span> as a target in <span class=""disease"" id=""15514168-8-158-171"">heart failure</span> drug discovery."	15514168.0	2005.0
Heart failure	C0018801	ACE2	59272	0.29	Biomarker		BEFREE	"<span class=""gene"" id=""24161906-1-0-31"">Angiotensin-converting enzyme 2</span> (<span class=""gene"" id=""24161906-1-33-37"">ACE2</span>) has been implicated in human <span class=""disease"" id=""24161906-1-68-81"">heart failure</span>, but the mechanism remains elusive."	24161906.0	2014.0
Heart failure	C0018801	AGTR1	185	0.6	Biomarker		BEFREE	"In conclusion, the diminished angiotensin II vasoconstriction with age in <span class=""disease"" id=""15569271-7-74-87"">heart failure</span> patients is most likely due to a lower density of <span class=""gene"" id=""15569271-7-138-142"">AT(1</span>) receptors and may result from a longer period of exposure to <span class=""disease"" id=""15569271-7-205-218"">heart failure</span> in older patients."	15569271.0	2005.0
Heart failure	C0018801	GATA4	2626	0.04	AlteredExpression		BEFREE	"In human <span class=""disease"" id=""15012912-12-9-22"">heart failure</span> (DCM) the calcineurin signaling pathway is activated <span class=""negexp"">not only by an increased activity of calcineurin and expression of</span> <span class=""gene"" id=""15012912-12-143-149"">GATA-4</span>, but also by the shift from dephosphorylated NFAT-3 to the nucleus indicating subcellular redistribution and regulatory activation."	15012912.0	2004.0
Heart failure	C0018801	DUSP1	1843	0.01	AlteredExpression		LHGDN	in patients with rheumatic heart disease and <span class=disease id=18095520>heart failure</span> <span class=gene id=18095520>MKP-1</span> activity was depressed in class IV patients compared to those in classes II and III	18095520.0	2007.0
Heart failure	C0018801	ROCK1	6093	0.01	GeneticVariation		BEFREE	"Again, genetic deletion of <span class=""gene"" id=""24901055-10-27-32"">ROCK1</span> partially but not completely rescued Rnd3 deficiency-mediated <span class=""disease"" id=""24901055-10-95-108"">heart failure</span> phenotype."	24901055.0	2015.0
Heart failure	C0018801	VEGFA	7422	0.39	AlteredExpression		BEFREE	"Increased expression of <span class=""gene"" id=""11298785-0-24-28"">VEGF</span> following exercise training in patients with <span class=""disease"" id=""11298785-0-74-87"">heart failure</span>."	11298785.0	2001.0
Heart failure	C0018801	MSTN	2660	0.51	Biomarker		CTD_human	"Myocardial <span class=""gene"" id=""16968467-13-11-20"">myostatin</span> mRNA and protein expression were up-regulated in the rat model of volume-overload <span class=""disease"" id=""16968467-13-103-116"">heart failure</span>."	16968467.0	2007.0
Heart failure	C0018801	PTN	5764	0.01	Biomarker		BEFREE	"Among these genes, many were observed to be involved in mitochondrial dysfunction and oxidative phosphorylation and 3 extracellular molecules, including periostin, <span class=""gene"" id=""19638707-7-164-176"">pleiotrophin</span>, and SERPINA3, which might become novel diagnostic and therapeutic targets for <span class=""disease"" id=""19638707-7-256-258"">HF</span>."	19638707.0	2009.0
Heart failure	C0018801	NFE2L1	4779	0.01	Biomarker		BEFREE	"Taken together, these findings suggest that the mitochondrial degeneration engaged in the skeletal muscle atrophy and the <span class=""disease"" id=""22912857-12-122-135"">heart failure</span> in the NF90 Tg mice may be caused by NF90-induced posttranscriptional repression of transcription factors such as PGC-1 and <span class=""gene"" id=""22912857-12-260-265"">NRF-1</span> for regulating nuclear-encoded genes relevant to mitochondrial function."	22912857.0	2013.0
Heart failure	C0018801	HSPA4	3308	0.03	Biomarker		BEFREE	"<span class=""gene"" id=""24748476-0-0-5"">Hsp70</span> regulates the doxorubicin-mediated <span class=""disease"" id=""24748476-0-41-54"">heart failure</span> in <span class=""gene"" id=""24748476-0-58-63"">Hsp70</span>-transgenic mice."	24748476.0	2015.0
Heart failure	C0018801	NCAM1	4684	0.22	Biomarker		RGD	"Increased expression of <span class=""gene"" id=""19853610-5-24-28"">NCAM</span> was also found during the remodeling period in a rat model of hypertension-induced <span class=""disease"" id=""19853610-5-112-125"">heart failure</span>."	19853610.0	2010.0
Heart failure	C0018801	ADRB1	153	0.6	Biomarker		CTD_human	Long-term treatment with angiotensin I-converting enzyme inhibitors attenuates the loss of cardiac beta-adrenoceptor responses in rats with chronic heart failure.	7586371.0	1995.0
Heart failure	C0018801	ANGPT1	284	0.02	Biomarker		BEFREE	"Targeting the ACE2-<span class=""gene"" id=""21147120-0-19-25"">Ang-(1</span>-7) pathway in cardiac fibroblasts to treat cardiac remodeling and <span class=""disease"" id=""21147120-0-92-105"">heart failure</span>."	21147120.0	2012.0
Heart failure	C0018801	SIRT1	23411	0.34	Therapeutic		CTD_human	"<span class=""disease"" id=""24535859-4-0-13"">Heart failure</span> was produced by myocardial infarction, and was associated with markedly increased AMPK and <span class=""gene"" id=""24535859-4-105-110"">SIRT1</span> protein levels."	24535859.0	2014.0
Heart failure	C0018801	PRKAG2	51422	0.11	Biomarker		HPO			
Heart failure	C0018801	PPP1R1A	5502	0.36	Therapeutic		CTD_human	Constitutively active phosphatase inhibitor-1 improves cardiac contractility in young mice but is deleterious after catecholaminergic stress and with aging.	20071777.0	2010.0
Heart failure	C0018801	NPY4R2	100996758	0.01	AlteredExpression		BEFREE	"In contrast, PLB, troponin I (TnI) and <span class=""gene"" id=""14732205-8-39-42"">PP1</span> protein and TnI phosphorylation levels did <span class=""negexp"">not differ between</span> <span class=""disease"" id=""14732205-8-105-107"">HF</span> and NF."	14732205.0	2004.0
Heart failure	C0018801	AGT	183	0.6	Biomarker		BEFREE	"However, increased ACE/ACE2 ratios may induce <span class=""gene"" id=""25869724-8-46-60"">angiotensin II</span> over-activation and accelerate cardiac remodeling in patients with moderate to severe <span class=""disease"" id=""25869724-8-147-160"">heart failure</span>."	25869724.0	2016.0
Heart failure	C0018801	BNIP3	664	0.21	Therapeutic		RGD	"In a rat model of pressure overload <span class=""disease"" id=""23508759-3-36-38"">HF</span>, <span class=""gene"" id=""23508759-3-40-45"">BNIP3</span> knockdown significantly decreased left ventricular (LV) volumes with significant improvement in LV diastolic and systolic function."	23508759.0	2013.0
Heart failure	C0018801	SDC4	6385	0.02	Biomarker		BEFREE	"<span class=""gene"" id=""23374111-4-0-10"">Syndecan-4</span>, a transmembrane heparan sulfate proteoglycan, is essential for pathological remodeling, and we here investigated its expression and shedding during <span class=""disease"" id=""23374111-4-160-173"">heart failure</span>."	23374111.0	2013.0
Heart failure	C0018801	BECN1	8678	0.2	Therapeutic		RGD	Adriamycin-induced autophagic cardiomyocyte death plays a pathogenic role in a rat model of heart failure.	18619688.0	2009.0
Heart failure	C0018801	LILRB1	10859	0.01	AlteredExpression		BEFREE	"By using this means, we innovatively revealed the vital role of <span class=""gene"" id=""26160134-6-64-69"">miR-7</span> in maintaining the dynamic balance of protein interactions and its obvious overexpression in MI and <span class=""disease"" id=""26160134-6-170-172"">HF</span> that implies pathological involvement."	26160134.0	2016.0
Heart failure	C0018801	OGA	10724	0.01	AlteredExpression		BEFREE	"We recently reported reduced <span class=""gene"" id=""25183011-3-29-32"">OGA</span> expression in the failing heart, which is consistent with the pro-adaptive role of increased O-GlcNAcylation during <span class=""disease"" id=""25183011-3-149-162"">heart failure</span>; however, molecular mechanisms regulating these enzymes during <span class=""disease"" id=""25183011-3-226-239"">heart failure</span> remain unknown."	25183011.0	2015.0
Heart failure	C0018801	NOS1	4842	0.23	Biomarker		BEFREE	"Cardiomyocyte <span class=""gene"" id=""18541744-9-14-18"">NOS1</span> may be a useful target against cardiac deterioration during chronic pressure-overload-induced <span class=""disease"" id=""18541744-9-113-115"">HF</span> through modulation of calcium cycling."	18541744.0	2008.0
Heart failure	C0018801	RYR2	6262	0.3	Biomarker		BEFREE	"Thus, defects in <span class=""gene"" id=""14659699-7-17-21"">RyR2</span> have been linked to <span class=""disease"" id=""14659699-7-42-55"">heart failure</span> and exercise-induced sudden cardiac death and might provide novel therapeutic targets for the treatment of these common diseases of the heart."	14659699.0	2004.0
Heart failure	C0018801	REN	5972	0.4	Biomarker		BEFREE	"<span class=""gene"" id=""18351457-0-0-5"">Renin</span>-angiotensin-aldosterone system (RAAS) pharmacogenomics: implications in <span class=""disease"" id=""18351457-0-78-91"">heart failure</span> management."	18351457.0	2010.0
Heart failure	C0018801	TFRC	7037	0.01	AlteredExpression		BEFREE	"In association, myocardial iron content was reduced in <span class=""disease"" id=""21777743-9-55-57"">HF</span> versus non-<span class=""disease"" id=""21777743-9-69-71"">HF</span> samples (0.49 ± 0.07 μg/g vs. 0.58 ± 0.09 μg/g, p &lt; 0.05), and there was a significant reduction (p &lt; 0.05) in the myocardial mRNA expression of <span class=""gene"" id=""21777743-9-217-221"">Tfr1</span>, which plays a key role in cellular iron transport."	21777743.0	2011.0
Heart failure	C0018801	NOS1	4842	0.23	AlteredExpression		BEFREE	"However, data on myocardial <span class=""gene"" id=""9809923-3-28-31"">NOS</span> expression in <span class=""disease"" id=""9809923-3-46-59"">heart failure</span> are conflicting."	9809923.0	1998.0
Heart failure	C0018801	TNF	7124	0.6	Biomarker		BEFREE	"This article reviews recent clinical and experimental material that suggest that the cytokines (e.g., <span class=""gene"" id=""10358791-3-102-129"">tumor necrosis factor alpha</span>), much like the neurohormones, may represent another class of biologically active molecules that are responsible for the development and progression of <span class=""disease"" id=""10358791-3-282-295"">heart failure</span>."	10358791.0	1999.0
Heart failure	C0018801	DNER	92737	0.03	AlteredExpression		BEFREE	"<span class=""gene"" id=""28515341-0-0-3"">BET</span> bromodomain inhibition suppresses innate inflammatory and profibrotic transcriptional networks in <span class=""disease"" id=""28515341-0-102-115"">heart failure</span>."	28515341.0	2018.0
Heart failure	C0018801	TCL1A	8115	0.01	AlteredExpression		BEFREE	"If so, screening for <span class=""gene"" id=""23630447-14-21-26"">TCL1A</span> and MDR1 SNPs or expression level in blood, might identify women at greatest risk of chemo-induced <span class=""disease"" id=""23630447-14-126-139"">heart failure</span>."	23630447.0	2013.0
Heart failure	C0018801	NR3C2	4306	0.4	Biomarker		BEFREE	"Targeting the <span class=""gene"" id=""25335936-3-14-40"">mineralocorticoid receptor</span> (<span class=""gene"" id=""25335936-3-42-44"">MR</span>) offers one approach for the treatment of <span class=""disease"" id=""25335936-3-87-100"">heart failure</span> with current strategies for novel <span class=""gene"" id=""25335936-3-135-137"">MR</span> therapeutics focusing on harnessing their cardio-protective benefits, but limiting the side effects of existing agents."	25335936.0	2015.0
Heart failure	C0018801	PPP2R1A	5518	0.01	AlteredExpression		BEFREE	"Thus, <span class=""gene"" id=""24465463-9-6-11"">PR65A</span> phosphorylation is an in vivo mechanism for regulation of the PP2A signaling complex and increased PP2A activity in <span class=""disease"" id=""24465463-9-128-141"">heart failure</span>."	24465463.0	2014.0
Heart failure	C0018801	TNF	7124	0.6	AlteredExpression		BEFREE	"Enhanced expression and shedding of <span class=""gene"" id=""9799654-0-36-57"">tumor necrosis factor</span> (<span class=""gene"" id=""9799654-0-59-62"">TNF</span>) receptors from mononuclear leukocytes in human <span class=""disease"" id=""9799654-0-111-124"">heart failure</span>."	9799654.0	1998.0
Heart failure	C0018801	INS	3630	0.3	Biomarker		CTD_human	Chronic heart failure-related interventions after starting rosiglitazone in patients receiving insulin.	15628829.0	2005.0
Heart failure	C0018801	PPARA	5465	0.06	Biomarker		BEFREE	"The <span class=""gene"" id=""16307905-1-4-52"">peroxisome proliferator-activated receptor alpha</span> (<span class=""gene"" id=""16307905-1-54-63"">PPARalpha</span>) is a central regulator of myocardial fatty acid (FA) metabolism implicated in the pathogenesis of <span class=""disease"" id=""16307905-1-163-176"">heart failure</span>."	16307905.0	2006.0
Heart failure	C0018801	IL18	3606	0.07	Biomarker		BEFREE	"Evidence for altered <span class=""gene"" id=""15371332-0-21-35"">interleukin 18</span> (<span class=""gene"" id=""15371332-0-37-43"">IL)-18</span> pathway in human <span class=""disease"" id=""15371332-0-61-74"">heart failure</span>."	15371332.0	2005.0
Heart failure	C0018801	SMAD1	4086	0.01	Biomarker		BEFREE	"<span class=""gene"" id=""22550179-3-0-5"">Smad1</span>/5 is highly activated in ECs of atherosclerotic lesions in diseased human coronary arteries from patients with end-stage <span class=""disease"" id=""22550179-3-127-140"">heart failure</span> undergoing heart transplantation and from apolipoprotein E-deficient mice."	22550179.0	2012.0
Heart failure	C0018801	NR3C1	2908	0.21	Biomarker		BEFREE	"<span class=""gene"" id=""20371666-0-0-23"">Glucocorticoid receptor</span> gene, low-grade inflammation, and <span class=""disease"" id=""20371666-0-58-71"">heart failure</span>: the Heart and Soul study."	20371666.0	2010.0
Heart failure	C0018801	RBFOX1	54715	0.02	Biomarker		BEFREE	"<span class=""gene"" id=""26619120-0-0-6"">RBFox1</span>-mediated RNA splicing regulates cardiac hypertrophy and <span class=""disease"" id=""26619120-0-63-76"">heart failure</span>."	26619120.0	2016.0
Heart failure	C0018801	SLC30A3	7781	0.1	GeneticVariation		GWASCAT	Pleiotropic Meta-Analyses of Longitudinal Studies Discover Novel Genetic Variants Associated with Age-Related Diseases.	27790247.0	2016.0
Heart failure	C0018801	ADM	133	0.24	Biomarker		RGD	"Ventricular <span class=""gene"" id=""12623952-0-12-26"">adrenomedullin</span> system in the transition from LVH to <span class=""disease"" id=""12623952-0-64-77"">heart failure</span> in rats."	12623952.0	2003.0
Heart failure	C0018801	AIMP2	7965	0.02	AlteredExpression		BEFREE	"The correlation between decreased MAPKAPK-2 phosphorylation and loss of active <span class=""gene"" id=""11448140-12-79-82"">p38</span> MAPK in failing human myocytes suggests that decreases in the activation of <span class=""gene"" id=""11448140-12-159-162"">p38</span> MAPK alpha, the predominant cardiac isoform, occur prior to end-stage <span class=""disease"" id=""11448140-12-233-246"">heart failure</span>."	11448140.0	2001.0
Heart failure	C0018801	ERBB2	2064	0.23	AlteredExpression		BEFREE	"These data do <span class=""negexp"">not exclude a role</span> for inhibition of cardiac <span class=""gene"" id=""14672400-16-59-63"">HER2</span> expression by trastuzumab in the onset of <span class=""disease"" id=""14672400-16-106-119"">heart failure</span> in trastuzumab-treated patients."	14672400.0	2004.0
Heart failure	C0018801	REN	5972	0.4	Biomarker		BEFREE	"Modulation of the <span class=""gene"" id=""12700890-3-18-23"">renin</span>-angiotensin system, particularly inhibition of the angiotensin-converting enzyme (ACE), has become a prime strategy in the treatment of hypertension and <span class=""disease"" id=""12700890-3-177-190"">heart failure</span>."	12700890.0	2004.0
Heart failure	C0018801	ACE	1636	0.6	GeneticVariation		BEFREE	"<span class=""gene"" id=""15571830-0-0-29"">Angiotensin converting enzyme</span> insertion/deletion polymorphism and the risk of <span class=""disease"" id=""15571830-0-78-91"">heart failure</span> in hypertensive subjects."	15571830.0	2005.0
Heart failure	C0018801	CSRP3	8048	0.29	Biomarker		BEFREE	"<span class=""gene"" id=""9039266-0-0-3"">MLP</span>-deficient mice exhibit a disruption of cardiac cytoarchitectural organization, dilated cardiomyopathy, and <span class=""disease"" id=""9039266-0-111-124"">heart failure</span>."	9039266.0	1997.0
Heart failure	C0018801	GRAP2	9402	0.02	Biomarker		BEFREE	"β₂-Adrenoceptors, NADPH oxidase, ROS and <span class=""gene"" id=""21271996-0-41-44"">p38</span> MAPK: another 'radical' road to <span class=""disease"" id=""21271996-0-77-90"">heart failure</span>?"	21271996.0	2011.0
Heart failure	C0018801	GCKR	2646	0.1	GeneticVariation		GWASCAT	Pleiotropic Meta-Analyses of Longitudinal Studies Discover Novel Genetic Variants Associated with Age-Related Diseases.	27790247.0	2016.0
Heart failure	C0018801	RND3	390	0.03	Biomarker		BEFREE	"<span class=""gene"" id=""24901055-0-0-4"">Rnd3</span> haploinsufficient mice are predisposed to hemodynamic stress and develop apoptotic cardiomyopathy with <span class=""disease"" id=""24901055-0-108-121"">heart failure</span>."	24901055.0	2015.0
Heart failure	C0018801	RYR2	6262	0.3	Biomarker		BEFREE	"Further, a critical signalling role for dysfunctional <span class=""gene"" id=""17052226-5-54-58"">RyR2</span> has also been implicated in the generation of arrhythmias in the common condition of <span class=""disease"" id=""17052226-5-144-161"">HF (heart failure</span>)."	17052226.0	2007.0
Heart failure	C0018801	ACE	1636	0.6	Biomarker		BEFREE	"The great variety of cardiovascular effects mediated by these vasoactive peptides and the efficacy of <span class=""gene"" id=""9428619-2-102-105"">ACE</span> inhibitors in the treatment of hypertension and <span class=""disease"" id=""9428619-2-154-167"">heart failure</span> emphasize the prominent role of <span class=""gene"" id=""9428619-2-200-203"">ACE</span> in the cardiovascular system."	9428619.0	1998.0
Heart failure	C0018801	HSPB7	27129	0.03	GeneticVariation		BEFREE	"Common variants in <span class=""gene"" id=""20124441-0-19-24"">HSPB7</span> and FRMD4B associated with advanced <span class=""disease"" id=""20124441-0-61-74"">heart failure</span>."	20124441.0	2010.0
Heart failure	C0018801	TRIM72	493829	0.01	Biomarker		BEFREE	"Enhancing muscle membrane repair by gene delivery of <span class=""gene"" id=""22314291-0-53-57"">MG53</span> ameliorates muscular dystrophy and <span class=""disease"" id=""22314291-0-93-106"">heart failure</span> in δ-Sarcoglycan-deficient hamsters."	22314291.0	2013.0
Heart failure	C0018801	ITPK1	3705	0.1	GeneticVariation		GWASCAT	Pleiotropic Meta-Analyses of Longitudinal Studies Discover Novel Genetic Variants Associated with Age-Related Diseases.	27790247.0	2016.0
Heart failure	C0018801	NCAM1	4684	0.22	Biomarker		BEFREE	"Together with our previous findings, these data support the involvement of <span class=""gene"" id=""24365773-11-75-79"">NCAM</span> in left ventricular remodeling, revealing new insights into the pathophysiology of <span class=""disease"" id=""24365773-11-163-176"">heart failure</span>."	24365773.0	2014.0
Heart failure	C0018801	NPPA	4878	0.59	Biomarker		CTD_human	The effect of early converting enzyme inhibition on neurohumoral activation in acute myocardial infarction.	8112904.0	1994.0
Heart failure	C0018801	TRPM4	54795	0.01	Biomarker		BEFREE	"TRPs are implicated in the development of cardiac hypertrophy (TRPC1, TRPC3, TRPC6), the electrophysiological perturbations associated with hypertrophy (<span class=""gene"" id=""17382525-6-153-158"">TRPM4</span>) and the progression to <span class=""disease"" id=""17382525-6-183-196"">heart failure</span> (<span class=""disease"" id=""17382525-6-198-203"">TRPC7</span>)."	17382525.0	2007.0
